<?xml version="1.0" encoding="utf-8"?>
<curso xmlns:xsi="http://www.w3.org/2001/XMLSchema-instance" xsi:noNamespaceSchemaLocation="curso.xsd">
	<guid>23</guid>
	<nome><![CDATA[Engenharia de Computadores e Telemática]]></nome>
	<nota></nota>
	<imagem><![CDATA[https://acesso.ua.pt/upload/imagens/c_23.png]]></imagem>
	<codigo>0300/9361</codigo>
	<grau><![CDATA[Mestrado Integrado]]></grau>
	<grauid><![CDATA[6]]></grauid>
	<ciclo>1</ciclo>
	<duracao>5 anos letivos / 10 semestres (300 créditos ECTS)</duracao>
	<ano_inicio>2006/2007</ano_inicio>
	<regime><![CDATA[Diurno / laboral]]></regime>
	<horario></horario>
	<propinas><![CDATA[697€/ano (ingresso no 1º ano) / 1000€/ano (ingresso no 4º ano)]]></propinas>
	<subsistema><![CDATA[Universitário]]></subsistema>
	<areas>
		<area><![CDATA[Informática]]></area>
	</areas>
	<director>
		<titulo>Prof. Doutor</titulo>
		<nome>Joaquim João Estrela Ribeiro Silvestre Madeira</nome>
		<email>jmadeira@ua.pt</email>
	</director>
	<departamentos>
		<departamento>
			<nome>Departamento de Eletrónica, Telecomunicações e Informática</nome>
			<url>http://www.ua.pt/deti</url>
		</departamento>
	</departamentos>
	<medias>
		<fase1>149</fase1>
		<fase2>0</fase2>
		<fase3>0</fase3>
	</medias>
	<vagas>
		<fase1>85</fase1>
		<fase2>0</fase2>
		<fase3>0</fase3>
	</vagas>
	<abrecandidaturas>true</abrecandidaturas>
	<provas><![CDATA[Um dos seguintes conjuntos:<br />
19 Matemática A<br />
      ou<br />
02 Biologia e Geologia<br />
19 Matemática A<br />
      ou<br />
07 Física e Química<br />
19 Matemática A
<br /><br /><strong>O cálculo da nota de acesso considera:</strong><ul><li>50% da nota do ensino secundário</li><li>50% da nota da prova de ingresso</li></ul>]]></provas>
	<ano_info><![CDATA[2020/2021]]></ano_info>
	<saidas_profissionais><![CDATA[<p>Os Mestres em Engenharia de Computadores e Telem&aacute;tica est&atilde;o preparados para intervir nas novas &aacute;reas que integram as tecnologias de informa&ccedil;&atilde;o, a ci&ecirc;ncia e engenharia de computadores e as telecomunica&ccedil;&otilde;es.</p>
<p>Assim, poder&atilde;o desempenhar fun&ccedil;&otilde;es em organiza&ccedil;&otilde;es p&uacute;blicas e privadas que realizem projetos de investiga&ccedil;&atilde;o, desenvolvimento e integra&ccedil;&atilde;o/utiliza&ccedil;&atilde;o de novas tecnologias da informa&ccedil;&atilde;o e comunica&ccedil;&atilde;o para a cria&ccedil;&atilde;o de novos servi&ccedil;os ligados &agrave; economia digital, de sistemas de informa&ccedil;&atilde;o ou para o projeto de equipamento.</p>
<p>Ser&atilde;o assim respons&aacute;veis tecnicamente por projetar, adaptar ou gerir solu&ccedil;&otilde;es, sistemas e redes inform&aacute;ticas complexas. As sa&iacute;das profissionais s&atilde;o m&uacute;ltiplas desde o setor dos servi&ccedil;os - onde &eacute; de real&ccedil;ar a banca, os seguros, o turismo, a cultura, o multim&eacute;dia - ao setor industrial, passando pela Administra&ccedil;&atilde;o P&uacute;blica Central, Local e Regional.</p>]]></saidas_profissionais>
	<objectivos><![CDATA[<p>&Eacute; indiscut&iacute;vel, hoje, que a independ&ecirc;ncia e o desenvolvimento de um pa&iacute;s passa grandemente pela capacidade de se autonomizar do ponto de vista tecnol&oacute;gico. Mat&eacute;rias como os Computadores, Telem&aacute;tica e Inform&aacute;tica s&atilde;o inevitavelmente de import&acirc;ncia primordial, quer pela sua relev&acirc;ncia como elementos coadjuvantes de outras t&eacute;cnicas, quer pela sua interven&ccedil;&atilde;o direta em sistemas que condicionam cada vez mais a vida das pessoas. Computadores, redes de telecomunica&ccedil;&otilde;es, sistemas embutidos, telem&oacute;veis s&atilde;o alguns dos exemplos importantes.</p>
<p>O curso de Mestrado Integrado em Computadores e Telem&aacute;tica da Universidade de Aveiro (MIECT-UA) tem por finalidade fornecer uma forma&ccedil;&atilde;o s&oacute;lida em ci&ecirc;ncias de base e de espetro largo nas &aacute;reas das tecnologias da computa&ccedil;&atilde;o, informa&ccedil;&atilde;o e das telecomunica&ccedil;&otilde;es, as quais t&ecirc;m vindo a assumir um papel dominante no setor industrial e o principal motor de desenvolvimento nas economias avan&ccedil;adas.</p>
<p>A tradi&ccedil;&atilde;o da Universidade de Aveiro neste dom&iacute;nio &eacute; forte. Aqui nasceu, por exemplo, o Servi&ccedil;o de Apontadores Portugueses (SAPO). A escolha de Aveiro como primeira Cidade Digital reflete tamb&eacute;m o capital de conhecimentos adquiridos nesta &aacute;rea, n&atilde;o s&oacute; pela Universidade como tamb&eacute;m por outras institui&ccedil;&otilde;es da cidade. Nos pr&oacute;ximos anos, os projetos que, no &acirc;mbito do programa Cidades Digitais, aqui se forem desenvolvendo dar&atilde;o, por certo, um excelente enquadramento &agrave; forma&ccedil;&atilde;o fornecida pela Mestrado Integrado em Computadores e Telem&aacute;tica.</p>
<p>A responsabilidade por esta licenciatura &eacute; assumida pelo Departamento de Eletr&oacute;nica, Telecomunica&ccedil;&otilde;es e Inform&aacute;tica da Universidade de Aveiro. Fundado em 1974, este departamento &eacute; detentor de um prestigiante historial nas &aacute;reas dos computadores e das telecomunica&ccedil;&otilde;es. O curr&iacute;culo do curso recorre, pois, &agrave;s compet&ecirc;ncias adquiridas para construir um perfil que fornece uma s&oacute;lida forma&ccedil;&atilde;o geral nas &aacute;reas da Engenharia Inform&aacute;tica.</p>]]></objectivos>
	<observacoes><![CDATA[É conferido o grau de licenciado em Ciências da Engenharia de Computadores e Telemática aos alunos que tenham realizado os 180 ECTS correspondentes aos primeiros seis semestres curriculares de trabalho.]]></observacoes>
	<testemunho></testemunho>
	<pre_requisitos></pre_requisitos>
	<local><![CDATA[Campus Universitário de Santiago, Aveiro]]></local>
	<urlmaisinfo></urlmaisinfo>
	<urlcandidaturas></urlcandidaturas>
	<urlmobilidade></urlmobilidade>
	<m23>
		<provas><![CDATA[matemática
<a href="https://www.ua.pt/pt/exames-entrevistas" target=_blank>programa</a>]]></provas>
		<vagas></vagas>
		<urlinfo><![CDATA[http://www.ua.pt/pt/m23]]></urlinfo>
		<observacoes></observacoes>
	</m23>
	<posgraduacoes>
		<corpo_docente></corpo_docente>
		<destinatarios></destinatarios>
		<vagas></vagas>
		<vagas_obs></vagas_obs>
		<urlmobilidade></urlmobilidade>
		<ano_info></ano_info>
		<fases>
			
			<fase>
				<numero><![CDATA[1]]></numero>
				<periodo><![CDATA[14/04/2020 a 24/04/2020]]></periodo>
				<edital><![CDATA[https://acesso.ua.pt/upload/editais/e_5015.pdf]]></edital>
				<ata><![CDATA[https://acesso.ua.pt/upload/atas/a_5015.pdf]]></ata>
				<datainicio><![CDATA[2020-03-23]]></datainicio>
				<datafim><![CDATA[2021-02-28]]></datafim>
				<vagas><![CDATA[25]]></vagas>
			</fase>
			
			<fase>
				<numero><![CDATA[2]]></numero>
				<periodo><![CDATA[20/07/2020 a 21/08/2020]]></periodo>
				<edital><![CDATA[https://acesso.ua.pt/upload/editais/e_5233.pdf]]></edital>
				<ata><![CDATA[https://acesso.ua.pt/upload/atas/a_5233.pdf]]></ata>
				<datainicio><![CDATA[2020-07-03]]></datainicio>
				<datafim><![CDATA[2021-02-28]]></datafim>
				<vagas><![CDATA[25]]></vagas>
			</fase>
			
		</fases>
	</posgraduacoes>
	<a3es>
		
		<situacao><![CDATA[acreditado]]></situacao>
		<numero><![CDATA[R/B -AD -660/2006]]></numero>
		<despacho><![CDATA[Declaracao_Retificacao_538_2013 ao Despacho n.º 4273/2013]]></despacho>
		<data><![CDATA[02/07/2014]]></data>
		<deliberacao><![CDATA[http://www.a3es.pt/pt/resultados-acreditacao/engenharia-de-computadores-e-telematica-0]]></deliberacao>
		<dr><![CDATA[Diário da República, 2.ª série — N.º 85 — 3 de maio de 2013]]></dr>
		
	</a3es>
	<acreditacoes>
	
		<acreditacao>
			<nome><![CDATA[selo de qualidade EUR-ACE]]></nome>
			<texto></texto>
			<imagem><![CDATA[http://acesso.ua.pt/images/cert_eurace.png]]></imagem>
			<url><![CDATA[http://www.enaee.eu/eur-ace-system]]></url>
		</acreditacao>
	
	</acreditacoes>
	<ultimaalteracao><![CDATA[15/10/2020 10:29:00]]></ultimaalteracao>
</curso>

