<?xml version="1.0" encoding="utf-8"?>
<curso xmlns:xsi="http://www.w3.org/2001/XMLSchema-instance" xsi:noNamespaceSchemaLocation="curso.xsd">
    <guid>27</guid>
    <nome><![CDATA[Engenharia Eletrónica e Telecomunicações]]></nome>
    <nota><![CDATA[marca EUR-ACE]]></nota>
    <imagem><![CDATA[http://acesso.ua.pt/upload/imagens/c_27.jpg]]></imagem>
    <codigo>0300/9365</codigo>
    <grau><![CDATA[Mestrado Integrado]]></grau>
    <grauid><![CDATA[6]]></grauid>
    <ciclo>1</ciclo>
    <duracao>5 anos letivos / 10 semestres (300 créditos ECTS)</duracao>
    <ano_inicio>2006/2007</ano_inicio>
    <regime><![CDATA[Diurno / laboral]]></regime>
    <horario></horario>
    <propinas><![CDATA[697€/ano (ingresso no 1º ano) / 1000€/ano (ingresso no 4º ano)]]></propinas>
    <subsistema><![CDATA[Universitário]]></subsistema>
    <areas>
        <area><![CDATA[Eletrotecnia]]></area>
    </areas>
    <director>
        <titulo>Prof. Doutor</titulo>
        <nome>António José Ribeiro Neves</nome>
        <email>an@ua.pt</email>
    </director>
    <departamentos>
        <departamento>
            <nome>Departamento de Eletrónica, Telecomunicações e Informática</nome>
            <url>http://www.ua.pt/deti</url>
        </departamento>
    </departamentos>
    <medias>
        <fase1>118,8</fase1>
        <fase2>0</fase2>
        <fase3>0</fase3>
    </medias>
    <vagas>
        <fase1>83</fase1>
        <fase2>2</fase2>
        <fase3>0</fase3>
    </vagas>
    <abrecandidaturas>true</abrecandidaturas>
    <provas><![CDATA[07 Física e Química <br />19 Matemática A
<br /><br /><strong>O cálculo da nota de acesso considera:</strong><ul><li>50% da nota do ensino secundário</li><li>50% da nota da prova de ingresso</li></ul>]]></provas>
    <ano_info><![CDATA[2020/2021]]></ano_info>
    <saidas_profissionais><![CDATA[<p>Os Mestres em Engenharia Eletr&oacute;nica e Telecomunica&ccedil;&otilde;es estar&atilde;o habilitados a desempenhar fun&ccedil;&otilde;es de quadros superiores em empresas p&uacute;blicas e privadas, cuja atividade envolva direta ou indiretamente a utiliza&ccedil;&atilde;o, gest&atilde;o e projeto de Sistemas Eletr&oacute;nicos (anal&oacute;gicos e digitais), Computadores, Telecomunica&ccedil;&otilde;es, Instrumenta&ccedil;&atilde;o, Automa&ccedil;&atilde;o e Controlo e An&aacute;lise e Processamento de Sinal.</p>
<p>As sa&iacute;das profissionais s&atilde;o m&uacute;ltiplas, situando-se nos operadores de telecomunica&ccedil;&otilde;es, nas empresas de produ&ccedil;&atilde;o e manuten&ccedil;&atilde;o de software, nos gabinetes de estudo e projetistas, nas empresas de consultoria, no setor financeiro, nos fabricantes e distribuidores de equipamento el&eacute;trico e eletr&oacute;nico, em todo o tipo de empresas industriais e de servi&ccedil;os e ainda em muitos servi&ccedil;os p&uacute;blicos.<br /><br /></p>]]></saidas_profissionais>
    <objectivos><![CDATA[<p>O Mestrado Integrado em Engenharia Eletr&oacute;nica e Telecomunica&ccedil;&otilde;es<br />tem como objetivo dar uma forma&ccedil;&atilde;o s&oacute;lida em ci&ecirc;ncias de base, e de espetro largo ao n&iacute;vel das ci&ecirc;ncias da especialidade, formando t&eacute;cnicos a n&iacute;vel superior, capazes de desempenhar fun&ccedil;&otilde;es de planeamento e projeto nos dom&iacute;nios dos Sistemas Eletr&oacute;nicos (anal&oacute;gicos e digitais), Computadores, Telecomunica&ccedil;&otilde;es, Instrumenta&ccedil;&atilde;o, Automa&ccedil;&atilde;o e Controlo e An&aacute;lise e Processamento de Sinal. Atrav&eacute;s de uma forma&ccedil;&atilde;o s&oacute;lida em ci&ecirc;ncias de base, pretende fornecer aos seus diplomados uma mais f&aacute;cil e eficaz adapta&ccedil;&atilde;o &agrave; r&aacute;pida evolu&ccedil;&atilde;o tecnol&oacute;gica. Atrav&eacute;s de uma forma&ccedil;&atilde;o de espetro largo ao n&iacute;vel das ci&ecirc;ncias da especialidade, procura dotar os seus diplomados de uma maior flexibilidade e vis&atilde;o de conjunto sobre a &aacute;rea profissional a que se destina. Qualquer destes objetivos &eacute;, em nossa opini&atilde;o, determinante para o desenvolvimento tecnol&oacute;gico sustentado do pa&iacute;s.</p>
<p>De facto, a forma&ccedil;&atilde;o oferecida por este Mestrado Integrado em Engenharia Eletr&oacute;nica e Telecomunica&ccedil;&otilde;es &eacute; orientada tanto para as exig&ecirc;ncias atuais da ind&uacute;stria nacional, como para dom&iacute;nios tecnol&oacute;gicos mais avan&ccedil;ados que vir&atilde;o a ter reflexos no pa&iacute;s a m&eacute;dio e longo prazo. Muitos dos atuais Engenheiros de Eletr&oacute;nica e Telecomunica&ccedil;&otilde;es formados pela Universidade de Aveiro ocupam hoje posi&ccedil;&otilde;es de destaque, n&atilde;o s&oacute; no mundo empresarial, como tamb&eacute;m no dom&iacute;nio do ensino e da investiga&ccedil;&atilde;o. A recetividade do mercado de trabalho tem sido total, chegando mesmo a verificar-se a contrata&ccedil;&atilde;o de muitos alunos antes de conclu&iacute;rem o curso. A cria&ccedil;&atilde;o da sua pr&oacute;pria empresa tem sido igualmente uma op&ccedil;&atilde;o para muitos desses Engenheiros.</p>]]></objectivos>
    <observacoes>
        <![CDATA[É conferido o grau de licenciado em Ciências da Engenharia Eletrónica e Telecomunicações aos alunos que tenham realizado os 180 ECTS correspondentes aos primeiros seis semestres curriculares de trabalho.]]></observacoes>
    <testemunho></testemunho>
    <pre_requisitos></pre_requisitos>
    <local><![CDATA[Campus Universitário de Santiago, Aveiro]]></local>
    <urlmaisinfo></urlmaisinfo>
    <urlcandidaturas></urlcandidaturas>
    <urlmobilidade></urlmobilidade>
    <m23>
        <provas>
            <![CDATA[matemática E física <a href="https://www.ua.pt/pt/exames-entrevistas" target=_blank>programa</a>]]></provas>
        <vagas></vagas>
        <urlinfo><![CDATA[http://www.ua.pt/pt/m23]]></urlinfo>
        <observacoes></observacoes>
    </m23>
    <posgraduacoes>
        <corpo_docente></corpo_docente>
        <destinatarios></destinatarios>
        <vagas></vagas>
        <vagas_obs></vagas_obs>
        <urlmobilidade></urlmobilidade>
        <ano_info></ano_info>
        <fases>

            <fase>
                <numero><![CDATA[1]]></numero>
                <periodo><![CDATA[14/04/2020 a 24/04/2020]]></periodo>
                <edital><![CDATA[https://acesso.ua.pt/upload/editais/e_5017.pdf]]></edital>
                <ata><![CDATA[https://acesso.ua.pt/upload/atas/a_5017.pdf]]></ata>
                <datainicio><![CDATA[2020-03-23]]></datainicio>
                <datafim><![CDATA[2021-02-28]]></datafim>
                <vagas><![CDATA[35]]></vagas>
            </fase>

            <fase>
                <numero><![CDATA[2]]></numero>
                <periodo><![CDATA[20/07/2020 a 21/08/2020]]></periodo>
                <edital><![CDATA[https://acesso.ua.pt/upload/editais/e_5237.pdf]]></edital>
                <ata><![CDATA[https://acesso.ua.pt/upload/atas/a_5237.pdf]]></ata>
                <datainicio><![CDATA[2020-07-03]]></datainicio>
                <datafim><![CDATA[2021-02-28]]></datafim>
                <vagas><![CDATA[35]]></vagas>
            </fase>

        </fases>
    </posgraduacoes>
    <a3es>

        <situacao><![CDATA[acreditado]]></situacao>
        <numero><![CDATA[R/A -Cr 1/2018]]></numero>
        <despacho><![CDATA[Aviso n.º 7108_2018]]></despacho>
        <data><![CDATA[11/01/2018]]></data>
        <deliberacao>
            <![CDATA[http://a3es.pt/pt/resultados-acreditacao/engenharia-electronica-e-telecomunicacoes-6]]></deliberacao>
        <dr><![CDATA[Diário da República, 2.ª série — N.º 101 — 25 de maio de 2018]]></dr>

    </a3es>
    <acreditacoes>

        <acreditacao>
            <nome><![CDATA[selo de qualidade EUR-ACE]]></nome>
            <texto></texto>
            <imagem><![CDATA[http://acesso.ua.pt/images/cert_eurace.png]]></imagem>
            <url><![CDATA[http://www.enaee.eu/eur-ace-system]]></url>
        </acreditacao>

    </acreditacoes>
    <ultimaalteracao><![CDATA[15/10/2020 10:30:00]]></ultimaalteracao>
</curso>

